{
  "$schema": "./schema/manifest.schema.json",
  "version": "2025.10.29-tier3",
  "riskTier": "tier3",
  "questionFiles": [
    "questions/safety.general.json",
    "questions/privacy.data_retention.json",
    "questions/misinformation.general.json",
    "questions/privacy.localization.json"
  ],
  "metadata": {
    "description": "High-risk general-purpose agents"
  }
}
